id	chinese	pinyin	japanese	category	level	example1_speaker	example1_avatar	example1_expression	example1_chinese	example1_pinyin	example1_japanese	example2_speaker	example2_avatar	example2_expression	example2_chinese	example2_pinyin	example2_japanese	notes
phrase_0751	请问附近有中国银行的自动取款机吗？	Qǐngwèn fùjìn yǒu Zhōngguó Yínháng de zìdòng qǔkuǎnjī ma?	すみません、この近くに中国銀行のATMはありますか？	money	1	A	犬	普通	师傅，我想买两斤红富士苹果。我只有一百块现金。	Shīfu, wǒ xiǎng mǎi liǎng jīn Hóngfùshì píngguǒ. Wǒ zhǐyǒu yībǎi kuài xiànjīn.	おじさん、サンふじリンゴを1キロ（2斤）ください。あ、現金100元しか持ってないや。	B	先生	普通	哎呀，现在谁还用现金啊，我这儿找不开。	Aiya, xiànzài shéi hái yòng xiànjīn a, wǒ zhèr zhǎo bù kāi.	あらまぁ、今時誰が現金なんて使うのさ。お釣りが出せないよ。	「自动取款机(zìdòng qǔkuǎnjī:ATM・キャッシュディスペンサー)」。口語では略して「ATM(エーティーエム)」と呼ぶことも多いです。スマホ決済社会の中国では現金の出番はほぼありません。
phrase_0752	我的银行卡被吞了，该怎么办？	Wǒ de yínhángkǎ bèi tūn le, gāi zěnme bàn?	キャッシュカードが機械に吸い込まれてしまったのですが、どうすればいいですか？	money	1	A	パンダ	驚く	喂！怎么黑屏了？我还在取钱呢！	Wèi! Zěnme hēipíng le? Wǒ hái zài qǔqián ne!	ちょっと！なんで画面が真っ暗になったの？まだお金おろしてる最中なのに！	B	先生	普通	这位女士，请不要拍打机器。	Zhè wèi nǚshì, qǐng búyào pāidǎ jīqì.	そちらの女性、機械を叩かないでください。	「银行卡(yínhángkǎ:銀行のキャッシュカード・デビットカード)」「被吞了(bèi tūn le:飲み込まれた)」。ATMの不具合やパスワード間違いでカードが没収されるトラブル。窓口（柜台）での手続きが必要です。
phrase_0753	现在买理财产品能有多少收益率？	Xiànzài mǎi lǐcái chǎnpǐn néng yǒu duōshao shōuyìlǜ?	今、「理財商品（資産運用商品）」を買うと、利回りはどのくらいになりますか？	money	2	A	私	普通	我想把这十万块钱存个定期。	Wǒ xiǎng bǎ zhè shí wàn kuài qián cún ge dìngqī.	この10万元を定期預金に入れたいのですが。	B	猫	笑う	先生，现在的定期存款利率太低了。您不如看看我们新推出的基金。	Xiānsheng, xiànzài de dìngqī cúnkuǎn lìlǜ tài dī le. Nín bùrú kànkan wǒmen xīn tuīchū de jījīn.	お客様、今の定期預金の金利は非常に低くなっております。当行が新しく発売したファンドをご検討されてはいかがでしょうか。	「理财产品(lǐcái chǎnpǐn:ネットや銀行で買える金融・資産運用商品)」「收益率(shōuyìlǜ:利回り・リターン)」「存定期(定期預金にする)」。中国の銀行の窓口（柜台）やアプリで盛んに行われる投資勧誘。
phrase_0754	我想开通网上银行和手机银行。	Wǒ xiǎng kāitōng wǎngshàng yínháng hé shǒujī yínháng.	インターネットバンキングとモバイルバンキングを開通したいです。	money	1	A	先生	普通	您好，请问要办理什么业务？您带身份证了吗？	Nínhǎo, qǐngwèn yào bànlǐ shénme yèwù? Nín dài shēnfènzhèng le ma?	こんにちは、どのようなお手続きをご希望ですか？身分証はお持ちですか？	B	パンダ	普通	带了。我想开通网上银行和手机银行，不然每次转账都要跑一趟网点，太麻烦了。	Dài le. Wǒ xiǎng kāitōng wǎngshàng yínháng hé shǒujī yínháng, bùrán měicì zhuǎnzhàng dōu yào pǎo yí tàng wǎngdiǎn, tài máfan le.	持ってきました。ネットバンキングとモバイルバンキングを開通したいんです。そうしないと、毎回振込のたびに支店まで足を運ばなければならず、面倒くさすぎるので。	「开通(kāitōng:開通する・アクティベートする)」「网上银行(wǎngshàng yínháng:ネットバンク/網銀)」。外国人留学生や駐在員が中国の銀行口座を開設（开户）する際、必ず覚えておきたいフレーズです。
phrase_0755	这家店可以直接刷信用卡吗？	Zhè jiā diàn kěyǐ zhíjiē shuā xìnyòngkǎ ma?	この店はクレジットカードが使えますか？	money	1	A	犬	普通	服务员，结账。我们一共有四个人。	Fúwùyuán, jiézhàng. Wǒmen yígòng yǒu sì ge rén.	すみません、お会計お願いします。全部で4人です。	B	猫	普通	好的先生，一共消费五百八十元。请问您怎么支付？	Hǎo de xiānsheng, yígòng xiāofèi wǔbǎi bāshí yuán. Qǐngwèn nín zěnme zhīfù?	かしこまりました。合計で580元になります。お支払い方法はいかがなさいますか？	「刷(shuā:（カードを）切る・スキャンする)」「信用卡(xìnyòngkǎ:クレジットカード)」。WeChat Pay（微信支付）やAlipay（支付宝）が強すぎる中国では、逆に物理のクレカが使えない個人店（小店）も多いです。
phrase_0756	微信支付和支付宝都可以，您扫我。	Wēixìn zhīfù hé Zhīfùbǎo dōu kěyǐ, nín sǎo wǒ.	WeChat PayとAlipayのどちらでも大丈夫です、あなたが私をスキャンしてください。	money	1	A	私	普通	老板，这两串糖葫芦多少钱？	Lǎobǎn, zhè liǎng chuàn tánghúlu duōshao qián?	おっちゃん、このサンザシの飴がけ2本でいくら？	B	先生	普通	十块钱。扫码就行。	Shí kuài qián. Sǎo mǎ jiù xíng.	10元だよ。QRスキャンしてくれればいい。	「支付(zhīfù:支払う・決済する)」「支付宝(Zhīfùbǎo)」「扫码(sǎo mǎ:QRをスキャンする)」。中国の屋台（路边摊）から高級店まで、どこでも聞かれるキャッシュレス社会でのやり取りです。
phrase_0757	现在的物价涨得太快了，工资却不涨。	Xiànzài de wùjià zhǎng de tài kuài le, gōngzī què bù zhǎng.	今の物価は上がるのが早すぎます、それなのに給料は上がりません。	money	2	A	パンダ	疲れる	今天去菜市场买了一斤排骨，竟然要五十块钱！	Jīntiān qù càishìchǎng mǎi le yì jīn páigǔ, jìngrán yào wǔshí kuài qián!	今日市場に行ってスペアリブ1斤買ったんだけど、なんと50元もしたのよ！	B	猫	悲しい	就是啊。现在的物价涨得太快了，工资却不涨。一到月底就成月光族了。	Jiù shì a. Xiànzài de wùjià zhǎng de tài kuài le, gōngzī què bù zhǎng. Yí dào yuèdǐ jiù chéng yuèguāngzú le.	そうよね。今の物価上がるのが早すぎよ、給料はホント上がらないんだから。月末になるともう「月光族」になっちゃうわ。	「物价涨(wùjià zhǎng:物価が値上がりする)」「工资(gōngzī:給料)」「月光族(yuèguāngzú:月末に給料をきれいさっぱり使い果たす若者たち)」。庶民の世知辛い愚痴の定番です。
phrase_0758	帮我换两千美金的现钞，我下周出国用。	Bāng wǒ huàn liǎngqiān měijīn de xiànchāo, wǒ xiàzhōu chūguó yòng.	私に2000USドルの現金を両替してください、来週出国する際に使います。	money	1	A	先生	普通	您好女士，您取号了吗？办理外汇业务请到三号窗口。	Nínhǎo nǚshì, nín qǔ hào le ma? Bànlǐ wàihuì yèwù qǐng dào sānhào chuāngkǒu.	こんにちはお客様、番号札は取られましたか？外貨業務のお手続きは3番窓口へお願いします。	B	パンダ	普通	好的。你好，帮我换两千美金的现钞，我下周出国用。最好给我一些零钱。	Hǎo de. Nǐhǎo, bāng wǒ huàn liǎngqiān měijīn de xiànchāo, wǒ xiàzhōu chūguó yòng. Zuìhǎo gěi wǒ yìxiē língqián.	はい。こんにちは、2000USドルを両替してください、来週出国して使うので。できれば少し小銭もちょうだい。	「换(huàn:換える・両替する)」「美金(měijīn:アメリカドル＝美元)」「现钞(xiànchāo:紙幣の現金)」。銀行窓口での外貨両替（兑换外币）。中国には厳しい外貨持ち出し制限がありますが、旅行の小遣いなら問題ありません。
phrase_0759	这个月的信用卡账单已经出来了，又要吃土了。	Zhège yuè de xìnyòngkǎ zhàngdān yǐjīng chūlái le, yòu yào chītǔ le.	今月のクレジットカードの請求額が確定しました。また極貧生活（金欠）の始まりです。	money	2	A	私	笑う	双十一你不是买了个新手机嘛，感觉怎么样？	Shuāng-shíyī nǐ bú shì mǎi le ge xīn shǒujī ma, gǎnjué zěnmeyàng?	独身の日（ダブルイレブン）に新しいスマホ買ったんだよね。使い心地はどう？	B	犬	悲しい	手机是挺好用的，但我现在连饭都吃不起了。这个月的信用卡账单已经出来了，又要吃土了。	Shǒujī shì tǐng hǎoyòng de, dàn wǒ xiànzài lián fàn dōu chī bù qǐ le. Zhège yuè de xìnyòngkǎ zhàngdān yǐjīng chūlái le, yòu yào chītǔ le.	スマホは最高だけど、今もう飯も食えないよ。今月のクレカの請求が来ちゃってさ、また「土を食う（金欠）」羽目になったよ。	「账单(zhàngdān:請求書・明細)」「吃土(chītǔ:土を食べる＝金がなさすぎて極貧生活を送る)」。ネットショッピングのセール（双十一など）で散財した若者が、月末に「蚂蚁花呗(Alipayの一括後払い)」の通知を見て絶望する様。
phrase_0760	他做生意亏了本，现在欠了一屁股债。	Tā zuò shēngyi kuī le běn, xiànzài qiàn le yí pìgu zhài.	彼は商売で大赤字を出してしまい、今は借金まみれです。	money	2	A	パンダ	驚く	听说隔壁那个开超市的老张跑路了？是真的吗？	Tīngshuō gébì nàge kāi chāoshì de Lǎo Zhāng pǎolù le? Shì zhēnde ma?	隣でスーパーをやってた張さんが夜逃げしたって聞いたけど、本当？	B	猫	悲しい	可不是嘛！他跨行去搞什么房地产投资。他做生意亏了本，现在欠了一屁股债，连夜卷钱跑了。	Kě bú shì ma! Tā kuàháng qù gǎo shénme fángdìchǎn tóuzī. Tā zuò shēngyī kuī le běn, xiànzài qiàn le yí pìgu zhài, liányè juǎnqián pǎo le.	本当よ！専門外の不動産投資なんかに手を出すから。商売で元手をすって借金まみれになって、一晩のうちに金持ってずらかったのよ。	「亏本(kuīběn:元本を損する・赤字になる)」「欠(一屁股)债(qiàn zhài:（お尻がいっぱいになるほどの多額の）借金をする)」。中国の民間ビジネス（做生意）の厳しい現実と、よくある「跑路(夜逃げ)」のニュース。
phrase_0761	股市风险太大，我还是把钱存在银行里比较踏实。	Gǔshì fēngxiǎn tài dà, wǒ háishi bǎ qián cún zài yínháng lǐ bǐjiào tāshi.	株式市場はリスクが大きすぎます、私はやはりお金を銀行に預けておくほうが比較的「地に足がついている」と感じます。	money	2	A	私	笑う	最近牛市来了，A股天天涨，你不拿点钱出来炒股吗？	Zuìjìn niúshì lái le, A-gǔ tiāntiān zhǎng, nǐ bù ná diǎnr qián chūlái chǎogǔ ma?	最近ブルマーケットが来てさ、A株が毎日上がってるんだ、お前も少し金出して株やらないか？	B	犬	普通	算了吧，我胆子小。股市风险太大，我还是把钱存在银行里比较踏实，至少这钱是稳的。	Suàn le ba, wǒ dǎnzi xiǎo. Gǔshì fēngxiǎn tài dà, wǒ háishi bǎ qián cún zài yínháng lǐ bǐjiào tāshi, zhìshǎo zhè qián shì wěn de.	やめとくよ、俺肝っ玉小さいから。株式市場はリスクでかすぎだよ、俺はやっぱりお金を銀行に預けておくほうが比較的安心できるよ、少なくともその金は安定してるからな。	「股市(gǔshì:株式市場)」「炒股(株をやる)」「存(cún:預ける・貯金する)」「踏实(tāshi:落ち着いている・安心できる)」。中国人は株（特にA株）や不動産など投資が大好きですが、痛い目を見る「韭菜(ニラ＝刈り取られるカモ)」も多いです。
phrase_0762	这房子的首付需要付百分之三十。	Zhè fángzi de shǒufù xūyào fù bǎifēnzhī-sānshí.	この家の頭金は、30パーセント支払う必要があります。	money	2	A	犬	疲れる	中介带我们看的那套两居室挺不错的，就是太贵了。	Zhōngjiè dài wǒmen kàn de nà tào liǎngjūshì tǐng búcuò de, jiùshì tài guì le.	仲介業者が案内してくれたあの2LDK、結構良かったけど、ただ高すぎるな。	B	猫	疲れる	是啊，总价要五百万呢。这房子的首付需要付百分之三十，也就是一百五十万，我们去哪儿借这么多钱去？	Shì a, zǒngjià yào wǔbǎi wàn ne. Zhè fángzi de shǒufù xūyào fù bǎifēnzhī-sānshí, yě jiùshì yìbǎi wǔshí wàn, wǒmen qù nǎr jiè zhème duō qián qù?	そうね、総額で500万元するんだから。この家の頭金は30%支払う必要があるのよ、つまり150万元。私たちどこに行ってこんな大金借りてくればいいの？	「首付(shǒufù:ローンの頭金・初回支払額)」。中国（特に一線都市）でマイホーム（买房）を手に入れるための最初の、そして最大の障壁。「凑首付(頭金をかき集める)」ために親戚中を走り回ります。
phrase_0763	你每个月的房贷和车贷加起来有多少？	Nǐ měige yuè de fángdài hé chēdài jiā qǐlái yǒu duōshao?	あなたが毎月住宅ローンとマイカーローンは、合わせてどのくらいありますか？	money	2	A	私	疲れる	哥们儿，周末去周边自驾游？	Gēmer, zhōumò qù zhōubiān zìjiàyóu?	兄弟、週末は周辺のドライブ旅行行かない？	B	犬	疲れる	不去不去，我要在家里加班做兼职。	Bú qù bú qù, wǒ yào zài jiālǐ jiābān zuò jiānzhí.	行かない行かない、俺家で残業して副業やらなきゃいけなくて。	「房贷(fángdài:住宅ローン＝房屋贷款)」「车贷(chēdài)」。頭金（首付）をクリアした後に待ち受ける、30年に及ぶ「房奴(家の奴隷)」生活の重圧を語る中年男性の哀愁です。
phrase_0764	我们公司这个季度的利润翻了一番。	Wǒmen gōngsī zhège jìdù de lìrùn fān le yì fān.	わが社の今四半期の利益は2倍に増えました。	money	2	A	先生	笑う	李总，恭喜恭喜！听说你们公司最近刚拿下了那个政府大项目。	Lǐ zǒng, gōngxǐ gōngxǐ! Tīngshuō nǐmen gōngsī zuìjìn gāng náxià le nàge zhèngfǔ dà xiàngmù.	李社長、おめでとうございます！御社は最近、政府の大きなプロジェクトを獲得されたそうですね。	B	私	笑う	同喜同喜。托大家的福，我们公司这个季度的利润翻了一番，今年的年会上肯定要发大红包。	Tóngxǐ tóngxǐ. Tuō dàjiā de fú, wǒmen gōngsī zhège jìdù de lìrùn fān le yì fān, jīnnián de niánhuì shang kěndìng yào fā dà hóngbāo.	ありがとうございます（お互い様です）。皆様のおかげで、今期の利益は2倍になりました。今年の忘年会（年次総会）では奮発してボーナス（紅包）を出さないといけませんね。	「利润(lìrùn:利益・利潤)」「翻一番(fān yí fān:2倍になる)」。※「翻两番」は2の2乗で4倍になるので注意。「季度(四半期)」。好景気な企業のビジネスマン（老板）同士の会話です。
phrase_0765	现在的年轻人越来越注重培养自己的理财观念。	Xiànzài de niánqīngrén yuèláiyuè zhùzhòng péiyǎng zìjǐ de lǐcái guānniàn.	今の若者はますます自身のマネーリテラシーを養うことを重視するようになっています。	money	2	A	パンダ	普通	你看小玲，明明刚毕业没多久，存的钱比我还多，每天都在看各种财商课。	Nǐ kàn Xiǎo Líng, míngmíng gāng bìyè méi duōjiǔ, cún de qián bǐ wǒ hái duō, měitiān dōu zài kàn gè zhǒng cáishāngkè.	玲ちゃん見てごらんなさいよ、明らかに卒業して間もないのに、貯めたお金私より多いのよ、毎日いろんなマネーリテラシークラスを見てるし。	B	先生	普通	很正常啊。现在的年轻人越来越注重培养自己的理财观念，不像我们那时候只知道存死钱。你不理财，财不理你嘛。	Hěn zhèngcháng a. Xiànzài de niánqīngrén yuèláiyuè zhùzhòng péiyǎng zìjǐ de lǐcái guānniàn, bú xiàng wǒmen nà shíhou zhǐ zhīdào cún sǐqián. Nǐ bù lǐcái, cái bù lǐ nǐ ma.	至って普通ですよ。今の若者はますます自身のマネーリテラシーを育成することに重きを置いています。	「注重(zhùzhòng:重きをおく・重視する)」「理财观念(lǐcái guānniàn:マネーリテラシー)」。中国の若者は「搞钱(金を稼ぐこと)」に対する執着が非常に強く、副業（搞副业）や投資に熱心です。
phrase_0766	老板，能不能便宜一点儿？给我打个折吧。	Lǎobǎn, nēng-bu-néng piányi yìdiǎnr? Gěi wǒ dǎ ge zhé ba.	店長さん、少し安くできませんか？私に割引してくださいよ。	money	1	A	猫	笑う	这件大衣标价八百块？也太贵了吧。	Zhè jiàn dàyī biāojià bābǎi kuài? Yě tài guì le ba.	このコート値札が800元？高すぎるでしょ。	B	先生	普通	美女，这是纯羊绒的，进价就很高，真的是一口价。	Měinv, zhè shì chún yángróng de, jìnjià jiù hěn gāo, zhēnde shì yìkǒujià.	お姉さん、これ純カシミヤだから仕入れ値からして高いのよ、本当にこれが一声なの。	「便宜(piányi:安い)」「打折(dǎzhé:割引する)」。アパレル市場（服装市场）や屋台での値切り（砍价）交渉の基本フレーズ。「抹零头(端数を切り捨てる)」などのテクニックが存在します。
phrase_0767	这次出差的所有费用都可以回公司报销。	Zhè cì chūchāi de suǒyǒu fèiyòng dōu kěyǐ huí gōngsī bàoxiāo.	今回の出張のすべての費用は、会社に戻って経費精算することができます。	money	2	A	私	疲れる	咱们这次去北京参加展会，连高铁票和酒店都要自己先垫付吗？	Zánmen zhè cì qù Běijīng cānjiā zhǎnhuì, lián gāotiěpiào hé jiǔdiàn dōu yào zìjǐ xiān diànfù ma?	俺たち今回北京に展覧会参加で行くけど、新幹線のチケットやホテル代まで自分でまず立て替えなきゃいけないのか？	B	犬	普通	别废话了，你记得把发票都开好收好。这次出差的所有费用都可以回公司报销，连打车费也算在内。	Bié fèihuà le, nǐ jìde bǎ fāpiào dōu kāihǎo shōuhǎo. Zhè cì chūchāi de suǒyǒu fèiyòng dōu kěyǐ huí gōngsī bàoxiāo, lián dǎchēfèi yě suàn zài nèi.	つべこべ言うな、領収書は全部ちゃんともらって保管しておくのを忘れんなよ。今回の出張の全費用は会社に戻って精算できるから。タクシー代まで含まれてるんだぞ。	「报销(bàoxiāo:精算する・経費で落とす)」「出差(chūchāi:出張する)」。会社員にとって最も重要な、経費精算システムに関する表現。「发票(fāpiào:公式の領収書・インボイス)」が必須です。
phrase_0768	我每个月都会存一笔固定的钱作为养老金。	Wǒ měige yuè dōu huì cún yì bǐ gùdìng de qián zuòwéi yǎnglǎojīn.	私は毎月、年金として固定の金額を必ず貯金しています。	money	2	A	猫	普通	你的工资也不低啊，怎么感觉你平时花钱那么节省？都没见你买过什么大牌包包。	Nǐ de gōngzī yě bù dī a，怎么感觉你平时花钱那么节省？都没见你买过什么大牌包包。	あなたの給料も低くないのに、なんで普段お金使うのそんなに節約してる感じなの？有名ブランドのバッグとか買ってるの見たことないわ。	B	パンダ	笑う	这叫未雨绸缪嘛。我每个月都会存一笔固定的钱作为养老金，我可不想老了以后还要伸手跟孩子要钱。	Zhè jiào wèiyǔ-chóumóu ma. Wǒ měige yuè dōu huì cún yì bǐ gùdìng de qián zuòwéi yǎnglǎojīn, wǒ kě bù xiǎng lǎo le yǐhòu hái yào shēnshǒu gēn háizi yàoqián.	「転ばぬ先の杖」って言うでしょ。私毎月固定の金額を老後資金として貯金してるのよ、歳とってから子供に手伸ばしてお金要求するなんて嫌だから。	「存一笔固定的钱(固定の（まとまった）お金を貯金する)」「养老金(yǎnglǎojīn:年金・老後資金)」。一人っ子政策の余波で「老龄化(高齢化)」が進む中国において、老後の備えは国に頼れない切実な課題です。
phrase_0769	最近人民币对日元的汇率是多少？	Zuìjìn Rénmínbì duì Rìyuán de huìlǜ shì duōshao?	最近、人民元と日本円の為替レートはいくつですか？	money	1	A	私	笑う	下个月我们就放年假了，我打算去东京旅游，顺手买点手办。	Xiàge yuè wǒmen jiù fàng niánjià le, wǒ dǎsuàn qù Dōngjīng lǚyóu, shùnshǒu mǎi diǎnr shǒubàn.	来月俺ら有給休暇になるから、東京に旅行に行って、ついでにフィギュアでも買おうと思ってるんだ。	B	犬	普通	好主意啊！最近人民币对日元的汇率是多少？是不是日元又贬值了，去那边消费很划算？	Hǎo zhǔyì a! Zuìjìn Rénmínbì duì Rìyuán de huìlǜ shì duōshao? Shì bu shì Rìyuán yòu biǎnzhí le, qù nàbiān xiāofèi hěn huásuàn?	いいアイデアだな！最近人民元対日本円の為替レートはどれくらい？また円安になってて、あっちで消費するのがお得なんじゃないか？	「人民币(Rénmínbì:人民元)」「汇率(huìlǜ:為替レート)」。海外旅行好きの中国人が常に気にしているのは為替と「免税(Miǎnshuì)」です。「贬值(価値が下がる)」。
phrase_0770	这套纪念币很有收藏价值，未来肯定会升值。	Zhè tào jìniànbì hěn yǒu shōucáng jiàzhí, wèilái kěndìng huì shēngzhí.	この記念硬貨のセットはとてもコレクション価値があり、未来には必ず値上がりするはずです。	money	2	A	先生	普通	爷爷，您花了三千块钱买这些铜板干什么？又不能当饭吃。	Yéye, nín huā le sānqiān kuài qián mǎi zhèxiē tóngbǎn gàn shénme? Yòu bùnéng dāng fàn chī.	おじいちゃん、3000元も使ってこういう銅貨買ってどうするんですか？これを飯代わりに食えないでしょ。	B	犬	笑う	小破孩你不懂。这套纪念币很有收藏价值，这是限量版，未来肯定会升值，就当是我留给你的传家宝了。	Xiǎo pò hái nǐ bù dǒng. Zhè tào jìniànbì hěn yǒu shōucáng jiàzhí, zhè shì xiànliàngbǎn, wèilái kěndìng huì shēngzhí, jiù dāng shì wǒ liú gěi nǐ de chuánjiābǎo le.	この記念硬貨のセットはとてもコレクション価値があり、これは限定版で、未来には必ず値上がりするはずです、私があなたに残す家宝にするつもりだ。	「收藏价值(shōucáng jiàzhí:コレクション価値、収集価値)」「升值(shēngzhí:値上がりする)」。古銭（古玩）や記念切手、茅台酒など、中国の高齢者は「形のあるもの」への投資を好みます。
phrase_0771	您的账户余额不足，请及时充值。	Nín de zhànghù yú'é bùzú, qǐng jíshí chōngzhí.	あなたのアカウント残高が不足しています、すみやかにチャージしてください。	money	2	A	先生	普通	滴——余额不足。	Dī——yú'é bùzú.	ピーッ——「残高不足」。	B	パンダ	普通	不好意思先生，机器提示您的账户余额不足，请及时充值，旁边的服务台就可以人工办啦。	Bù hǎoyìsi xiānsheng, jīqì tíshì nín de zhànghù yú'é bùzú, qǐng jíshí chōngzhí, pángbiān de fúwùtái jiù kěyǐ réngōng bàn la.	すみませんお客様、機械があなたの口座の残高不足を通知しています、すみやかにチャージしてください。横のサービスカウンターで有人対応できますよ。	「余额(yú'é:残高)」「不足(bùzú)」「及时(jíshí:タイムリーに、すぐに)」「充值(chōngzhí:チャージする)」。交通機関ICカード（公交卡）やスマホゲームなど、様々なアプリから通知される無慈悲なシステムメッセージです。
