id	chinese	pinyin	japanese	category	level	example1_speaker	example1_avatar	example1_expression	example1_chinese	example1_pinyin	example1_japanese	example2_speaker	example2_avatar	example2_expression	example2_chinese	example2_pinyin	example2_japanese	notes
phrase_951	随你的便。	Suí nǐ de biàn.	好きにして。	basic	1	A	猫	普通	我想自己决定这件事。	Wǒ xiǎng zìjǐ juédìng zhè jiàn shì.	この件は自分で決めたいんだ。	B	私	普通	随你的便。	Suí nǐ de biàn.	好きにして。	相手の自由にさせるという意味ですが、少し突き放すようなニュアンスが含まれることもあります。
phrase_952	别提了。	Bié tí le.	（嫌な思い出なので）聞かないでください。	basic	1	A	犬	普通	昨天的考试怎么样？	Zuótiān de kǎoshì zěnmeyàng?	昨日の試験はどうだった？	B	私	悲しい	别提了。	Bié tí le.	もう、その話はしないでください……。	思い出したくもない失敗や、残念な結果に終わったことに対して「言いたくない」「聞かないで」とはぐらかす時のフレーズです。
phrase_953	不好意思。	Bù hǎoyìsi.	すみません。	basic	1	A	犬	普通	抱歉，让一下。	Bàoqiàn, ràng yíxià.	ごめん、ちょっと通して。	B	私	普通	不好意思。	Bù hǎoyìsi.	すみません。	軽い謝罪や、人に声をかける時の「すみません」として日常的に多用されます。
phrase_954	让我看看。	Ràng wǒ kànkan.	見せて。	basic	1	A	猫	普通	你看我买的新包。	Nǐ kàn wǒ mǎi de xīn bāo.	見て、私が買った新しいバッグ。	B	私	普通	让我看看。	Ràng wǒ kànkan.	見せて。	相手の持っているものを見せてほしい時や、確認したい時に使います。
phrase_955	你在开玩笑吧？	Nǐ zài kāi wánxiào ba?	冗談でしょう？	basic	1	A	パンダ	普通	刚才老板说要发奖金了。	Gāngcái lǎobǎn shuō yào fā jiǎngjīn le.	さっき社長がボーナスを出すって言ってたよ。	B	私	驚く	你在开玩笑吧？	Nǐ zài kāi wánxiào ba?	冗談でしょう？	信じられない話やからかわれた時に、「嘘でしょ？」と返すフレーズです。
phrase_956	怎么可能？	Zěnme kěnéng?	そんなばかな。	basic	1	A	犬	普通	你看这只狗会算数！	Nǐ kàn zhè zhǐ gǒu huì suànshù!	見て、この犬計算ができるよ！	B	私	驚く	怎么可能？	Zěnme kěnéng?	そんなばかな。	常識的にありえないと思うことを否定する時に使います。
phrase_957	我同意。	Wǒ tóngyì.	賛成です。	basic	1	A	先生	普通	大家觉得这个提议怎么样？	Dàjiā juéde zhège tíyì zěnmeyàng?	みなさん提案はどう思いますか？	B	私	普通	我同意。	Wǒ tóngyì.	賛成です。	会議や議論の場で、はっきりと賛意を示すフォーマルな表現です。
phrase_958	我反对。	Wǒ fǎnduì.	反対です。	basic	1	A	先生	普通	我认为应该取消这个项目。	Wǒ rènwéi yīnggāi qǔxiāo zhège xiàngmù.	このプロジェクトは中止すべきだと思います。	B	私	怒る	我反对。	Wǒ fǎnduì.	反対です。	相手の意見にきっぱりと反対する時に使われますが、少し強いニュアンスになります。
phrase_959	毫无疑问。	Háo wú yíwèn.	疑う余地はない。	basic	1	A	犬	普通	他是我们队里最强的选手吧。	Tā shì wǒmen duì li zuì qiáng de xuǎnshǒu ba.	彼がうちのチームで一番強い選手だよね。	B	私	普通	毫无疑问。	Háo wú yíwèn.	疑う余地はない。	絶対的に正しい、これ以上議論する必要がないという確信を表します。
phrase_960	当然不行。	Dāngrán bùxíng.	当然ダメだよ。	basic	1	A	猫	普通	我可以借你的车用一下吗？	Wǒ kěyǐ jiè nǐ de chē yòng yíxià ma?	君の車をちょっと借りていい？	B	私	普通	当然不行。	Dāngrán bùxíng.	当然ダメだよ。	相手の依頼や許可を強く拒絶するきっぱりとした表現です。
phrase_961	交给我吧。	Jiāogěi wǒ ba.	私に任せて。	basic	1	A	パンダ	普通	这个软件不知道怎么装。	Zhège ruǎnjiàn bù zhīdào zěnme zhuāng.	このソフト、どうやってインストールするかわからないや。	B	私	普通	交给我吧。	Jiāogěi wǒ ba.	私に任せて。	自分が引き受けるから安心して、という心強い返事です。
phrase_962	我做不到。	Wǒ zuò bù dào.	私にはできない。	basic	1	A	犬	普通	明天的马拉松你能跑完全程吗？	Míngtiān de mǎlāsōng nǐ néng pǎo wán quánchéng ma?	明日のマラソン、君は完走できそう？	B	私	悲しい	我做不到。	Wǒ zuò bù dào.	私にはできない。	自分の能力を超えている、物理的に無理だとギブアップする時に言います。
phrase_963	你确定吗？	Nǐ quèdìng ma?	確かですか？	basic	1	A	先生	普通	明天不用来上班了。	Míngtiān búyòng lái shàngbān le.	明日は出社しなくていいですよ。	B	私	驚く	你确定吗？	Nǐ quèdìng ma?	確かですか？	相手の決定や言うことが本当に間違いないか、念押しで確認する表現です。
phrase_964	那又怎样？	Nà yòu zěnyàng?	それがどうしたっていうんですか？	basic	1	A	猫	普通	你这样做大家都会笑话你的。	Nǐ zhèyàng zuò dàjiā dōu huì xiàohua nǐ de.	そんなことしたら、みんなに笑われちゃうよ。	B	私	普通	那又怎样？	Nà yòu zěnyàng?	それがどうしたっていうんですか？	他人の評価や世間の目を気にせず、「別にいいじゃないか」「関係ないだろ」と反発する、少し強気で自己主張の強い表現です。
phrase_965	有什么事吗？	Yǒu shénme shì ma?	何か用ですか？	basic	1	A	犬	普通	打扰一下。	Dǎrǎo yíxià.	ちょっとすいません。	B	私	普通	有什么事吗？	Yǒu shénme shì ma?	何か用ですか？	声をかけられた時に、「はい、何でしょうか」と応対するベーシックなフレーズです。
phrase_966	我马上就来。	Wǒ mǎshàng jiù lái.	すぐ行きます。	basic	1	A	パンダ	普通	大家都在等你呢。	Dàjiā dōu zài děng nǐ ne.	みんな君を待ってるよ。	B	私	普通	我马上就来。	Wǒ mǎshàng jiù lái.	すぐ行きます。	誰かに呼ばれたり、待たせている時に「ちょっと待ってて、すぐ向かうから」と答える言葉。
phrase_967	安静一点。	Ānjìng yìdiǎn.	少し静かにして。	basic	1	A	犬	普通	哈哈哈哈这太好笑了。	Hāhāhāhā zhè tài hǎoxiào le.	あははは、これマジで面白い。	B	私	怒る	安静一点。	Ānjìng yìdiǎn.	少し静かにして。	うるさい相手に注意するストレートな言葉です。少し強く響きます。
phrase_968	别担心。	Bié dānxīn.	心配しないで。	basic	1	A	猫	普通	明天的考试我很紧张。	Míngtiān de kǎoshì wǒ hěn jǐnzhāng.	明日のテスト、すごく緊張してる。	B	私	普通	别担心。	Bié dānxīn.	心配しないで。	不安になっている人を安心させるための最もシンプルで優しい励ましです。
phrase_969	放心吧。	Fàngxīn ba.	安心してください。	basic	1	A	先生	普通	这件事交给你没问题吧？	Zhè jiàn shì jiāogěi nǐ méi wèntí ba?	この件は君に任せても大丈夫かな？	B	私	普通	放心吧。	Fàngxīn ba.	安心してください。	「私に任せて安心しろ」と相手の不安を取り除く力強い言葉です。
phrase_970	振作起来。	Zhènzuò qǐlái.	元気を出して。	basic	1	A	犬	悲しい	我又搞砸了。	Wǒ yòu gǎozá le.	また失敗しちゃった。	B	私	普通	振作起来。	Zhènzuò qǐlái.	元気を出して。	落ち込んでいる相手の肩を叩いて励ます、「しっかりしろ」という言葉です。
phrase_971	恭喜恭喜。	Gōngxǐ gōngxǐ.	おめでとう。	basic	1	A	猫	普通	我下个月要结婚了。	Wǒ xià ge yuè yào jiéhūn le.	私、来月結婚するの。	B	私	笑う	恭喜恭喜。	Gōngxǐ gōngxǐ.	おめでとう。	おめでたいこと、合格、結婚、お正月など祝い事に欠かせないお祝いのフレーズ。
phrase_972	太棒了。	Tài bàng le.	素晴らしい。	basic	1	A	犬	普通	这次比赛大家得了第一名！	Zhè cì bǐsài dàjiā dé le dìyī míng!	今回の大会で優勝したよ！	B	私	笑う	太棒了。	Tài bàng le.	素晴らしい。	最高に嬉しい時や、相手の成果を心から称賛するテンションの高い言葉。
phrase_973	真可惜。	Zhēn kěxī.	本当に残念だ。	basic	1	A	猫	普通	演唱会的票没抢到。	Yǎnchànghuì de piào méi qiǎng dào.	ライブのチケットが取れなかったよ。	B	私	悲しい	真可惜。	Zhēn kěxī.	本当に残念だ。	惜しい結果に終わった時や、悔しい気持ちを共感する時に使われます。
phrase_974	糟了。	Zāo le.	しまった。	basic	1	A	犬	普通	怎么了？	Zěnme le?	どうしたの？	B	私	驚く	糟了。	Zāo le.	しまった。	予想外のミスに気づいたり、悪い状況になってしまった時に焦って言う一言。
phrase_975	别傻了。	Bié shǎ le.	馬鹿なこと言わないで。	basic	1	A	パンダ	普通	天上掉馅饼了。	Tiān shàng diào xiànbǐng le.	空から牡丹餅が落ちてきたぞ。	B	私	怒る	别傻了。	Bié shǎ le.	馬鹿なこと言わないで。	ばかげた考えや不可能なことを期待している相手に、現実を見るよう促すセリフ。