id	chinese	pinyin	japanese	category	level	example1_speaker	example1_avatar	example1_expression	example1_chinese	example1_pinyin	example1_japanese	example2_speaker	example2_avatar	example2_expression	example2_chinese	example2_pinyin	example2_japanese	notes
phrase_0126	在哪儿？	Zài nǎr?	どこですか？	travel	1	A	cat	normal	请问洗手间在哪儿？	Qǐngwèn xǐshǒujiān zài nǎr?	お尋ねしますが、お手洗いはどこですか？	B	dog	happy	在那边，直走就到了。	Zài nàbian, zhízǒu jiù dào le.	あちらです、まっすぐ行けば着きますよ。	場所を尋ねる最も基礎的で必須のフレーズです。「哪儿（アール化）」は北京などの北方なまりで、南方では「哪里(nǎlǐ)」がよく使われます。
phrase_0127	怎么走？	Zěnme zǒu?	どうやって行きますか？	travel	1	A	panda	normal	请问去火车站怎么走？	Qǐngwèn qù huǒchēzhàn zěnme zǒu?	すみません、駅へはどう行けばいいですか？	B	sensei	normal	你可以在前面坐地铁。	Nǐ kěyǐ zài qiánmiàn zuò dìtiě.	前のところから地下鉄に乗れますよ。	「怎么（どうやって）＋走（行く、歩く）」。目的地までの道順や交通手段を尋ねる時の定番表現。
phrase_0128	直走。	Zhízǒu.	まっすぐ進みます。	travel	1	A	me	normal	去超市应该怎么走？	Qù chāoshì yīnggāi zěnme zǒu?	スーパーにはどう行けばいいですか？	B	dog	normal	从这里一直往前直走。	Cóng zhèlǐ yìzhí wǎng qián zhízǒu.	ここからずっと前へ真っ直ぐに進んでください。	道を教えられる時に最もよく耳にする単語です。「一直走(yìzhízǒu：ずっとまっすぐ)」という強調形も頻出します。
phrase_0129	右拐。	Yòuguǎi.	右に曲がる。	travel	2	A	cat	normal	十字路口怎么走？	Shízì lùkǒu zěnme zǒu?	十字路はどう行きますか？	B	panda	happy	到了十字路口右拐。	Dào le shízì lùkǒu yòuguǎi.	十字路に着いたら右に曲がります。	「拐(guǎi)」は曲がるという意味。中国北部でよく使われ、南部や台湾では「右转(yòuzhuǎn)」と言うことが多いです。
phrase_0130	左拐。	Zuǒguǎi.	左に曲がります。	travel	2	A	me	normal	师傅，在前面的路口左拐。	Shīfu, zài qiánmiàn de lùkǒu zuǒguǎi.	運転手さん、前の交差点で左に曲がってください。	B	sensei	normal	好的，左拐之后就到了吗？	Hǎo de, zuǒguǎi zhīhòu jiù dào le ma?	はい、左折したらすぐ着きますか？	タクシーに乗っている時の必須フレーズです。方向を指示できるようになれば、旅行中の移動がグッと楽になります。
phrase_0131	在这里停。	Zài zhèlǐ tíng.	ここで停めてください。	travel	1	A	panda	happy	师傅，就在这里停吧。	Shīfu, jiù zài zhèlǐ tíng ba.	運転手さん、ここで停めてください。	B	dog	normal	好的，一共三十块钱。	Hǎo de, yígòng sānshí kuài qián.	はい、全部で30元ね。	「停(tíng)」はストップの意味。タクシーで目的地周辺に着いた時、一番安全な場所で降ろしてもらうための言葉です。
phrase_0132	远吗？	Yuǎn ma?	遠いですか？	travel	1	A	cat	tired	我们要走到酒店，远吗？	Wǒmen yào zǒu dào jiǔdiàn, yuǎn ma?	ホテルまで歩くけど、遠いの？	B	me	happy	不远，大概五分钟。	Bù yuǎn, dàgài wǔ fēnzhōng.	遠くないよ、大体5分くらい。	距離の「遠さ」を尋ねるシンプルで強力な言葉。「太远了（遠すぎる）」「很近（とても近い）」とセットで覚えましょう。
phrase_0133	要多久？	Yào duōjiǔ?	どのくらいかかりますか？	travel	1	A	dog	normal	坐高铁去上海要多久？	Zuò gāotiě qù Shànghǎi yào duōjiǔ?	新幹線で上海へ行くのにどのくらいかかりますか？	B	sensei	normal	大概需要五个小时。	Dàgài xūyào wǔ ge xiǎoshí.	だいたい5時間必要ですね。	「多（どれくらい）＋久（久しい/時間が経つ）」。移動時間だけでなく、待ち時間や修理時間など何にでも使える時間確認の便利ワード。
phrase_0134	买票。	Mǎipiào.	チケットを買う。	travel	1	A	panda	happy	我们先去买票吧。	Wǒmen xiān qù mǎipiào ba.	先にチケットを買いに行こう。	B	cat	normal	好，你要买几张？	Hǎo, nǐ yào mǎi jǐ zhāng?	うん、何枚買うの？	「票(piào)」はチケット全般を指します（映画、電車、飛行機など）。「售票处(shòupiàochù)」がチケット売り場の意味。
phrase_0135	一张票。	Yì zhāng piào.	チケット1枚。	travel	1	A	me	normal	你好，我要买一张票。	Nǐhǎo, wǒ yào mǎi yì zhāng piào.	こんにちは、チケットを1枚買いたいです。	B	sensei	happy	好的，给您，一百块。	Hǎo de, gěi nín, yìbǎi kuài.	はいどうぞ、100元です。	チケットや紙を数える時の量詞は「张(zhāng)」です。2枚買いたい時は「二张」ではなく「两张(liǎng zhāng)」になるので注意！
phrase_0136	这趟车。	Zhè tàng chē.	この電車。	travel	2	A	dog	normal	请问，这趟车去机场吗？	Qǐngwèn, zhè tàng chē qù jīchǎng ma?	すみません、このバスは空港に行きますか？	B	cat	normal	不去，去机场要坐下一趟。	Bú qù, qù jīchǎng yào zuò xià yí tàng.	行きませんよ、空港へは次の便に乗ってください。	「趟(tàng)」は列車の運行や往復の回数を数える量詞。乗り間違えを防ぐために乗車直前に周りの人に確認するためのフレーズ。
phrase_0137	下一站。	Xià yí zhàn.	次の駅。	travel	1	A	panda	surprised	糟糕，我们是不是坐过站了？	Zāogāo, wǒmen shì bú shì zuò guò zhàn le?	しまった、私たち乗り過ごしたんじゃない？	B	me	normal	没有，下一站才是。	Méiyǒu, xià yí zhàn cái shì.	ううん、次の駅がそうだよ。	バスや地下鉄のアナウンスで最もよく耳にする言葉。「上一站（前の駅）」「终点站（終点）」も関連語彙です。
phrase_0138	下车。	Xiàchē.	車を降りる。	travel	1	A	dog	happy	前面那一站我们就下车。	Qiánmiàn nà yí zhàn wǒmen jiù xiàchē.	前の駅で私たち降りるよ。	B	cat	happy	好的，我拿好行李了。	Hǎo de, wǒ ná hǎo xínglǐ le.	オッケー、荷物は持ったよ。	乗り物から降りること。逆に乗り込むことは「上车(shàngchē)」と言います。
phrase_0139	几点开门？	Jǐ diǎn kāimén?	何時に開きますか？	travel	1	A	me	normal	我想去博物馆，几点开门？	Wǒ xiǎng qù bówùguǎn, jǐ diǎn kāimén?	博物館に行きたいんだけど、何時に開く？	B	sensei	normal	早上九点开门。	Zǎoshang jiǔ diǎn kāimén.	朝の9時に開くよ。	お店や観光地の営業時間を寻ねる時。「开门（ドアを開ける）」で開店や営業開始を表します。
phrase_0140	关门了。	Guānmén le.	閉まってしまいました。	travel	1	A	panda	sad	哎呀，这家饭店已经关门了。	Āiyā, zhè jiā fàndiàn yǐjīng guānmén le.	あっ、このレストラン、もう閉まってしまいましたね。	B	dog	tired	太倒霉了，我们换一家吧。	Tài dǎoméi le, wǒmen huàn yì ja ba.	ついてないですね、別のお店に行きましょう。	「关门（ドアを閉める）」は閉店のこと。文末の「了」は「状態の変化（つい先ほど閉まった）」を表す重要なサインです。
phrase_0141	迷路了。	Mílù le.	道に迷った。	travel	2	A	cat	sad	这里是哪里啊？我迷路了。	Zhèlǐ shì nǎlǐ a? Wǒ mílù le.	ここはどこなの？道に迷っちゃった。	B	sensei	normal	别慌，用手机看一下地图。	Bié huāng, yòng shǒujī kàn yíxià dìtú.	焦らないで、スマホで地図を見てごらん。	「迷（迷う）＋路（道）」。慣れない土地でパニックになった時、「帮帮我（助けて）」とセットで周りの人に使って助けを求めましょう。
phrase_0142	打车。	Dǎchē.	タクシーに乗る。	travel	1	A	me	tired	走得好累，我们打车吧。	Zǒu de hǎo lèi, wǒmen dǎchē ba.	歩き疲れたから、タクシーに乗ろう。	B	panda	happy	好的，天气也热，打车舒服。	Hǎo de, tiānqì yě rè, dǎchē shūfu.	いいね、暑いしタクシーの方が快適だよ。	「打(手で叩く、アクションを起こす)＋车」。現在では配車アプリ（滴滴出行など）で車を呼ぶ事も広く「打车」と言います。
phrase_0143	注意安全。	Zhùyì ānquán.	気をつけてくださいね。	daily	2	A	dog	happy	我今天骑自行车去上班。	Wǒ jīntiān qí zìxíngchē qù shàngbān.	今日は自転車で出勤します。	B	cat	normal	路上车多，注意安全。	Lùshang chē duō, zhùyì ānquán.	道は車が多いから、気をつけてくださいね。	外出する家族や友人にかける、思いやりのこもった定番の言葉です。「小心（気をつけて）」よりも丁寧な響きがあります。
phrase_0144	行李。	Xínglǐ.	荷物。	travel	1	A	panda	tired	我的行李太重了。	Wǒ de xínglǐ tài zhòng le.	私の荷物重すぎるよ。	B	me	happy	我帮你拿一个吧。	Wǒ bāng nǐ ná yí ge ba.	一つ持ってあげるよ。	旅行用カバンなどの「荷物」全般を指します。「行李箱（スーツケース）」とも言います。
phrase_0145	护照。	Hùzhào.	パスポート。	travel	1	A	sensei	normal	办理入住需要看您的护照。	Bànlǐ rùzhù xūyào kàn nín de hùzhào.	チェックインにはパスポートの提示が必要です。	B	dog	happy	好的，给你。	Hǎo de, gěi nǐ.	はい、どうぞ。	海外旅行において絶対に必要な単語。「丢了（無くした）」と「护照」の組み合わせだけは避けるようにしっかり管理しましょう。
phrase_0146	签证。	Qiānzhèng.	ビザ。	travel	2	A	cat	normal	你去中国需要办签证吗？	Nǐ qù Zhōngguó xūyào bàn qiānzhèng ma?	中国に行くのにビザは必要ですか？	B	me	normal	是的，我正在准备材料。	Shì de, wǒ zhèngzài zhǔnbèi cáiliào.	はい、今書類を準備しています。	渡航手続きの際によく使われます。「办签证（ビザを申請・取得する）」という組み合わせで覚えておくと便利。
phrase_0147	机票。	Jīpiào.	航空券。	travel	1	A	panda	happy	我已经订好去北京的机票了。	Wǒ yǐjīng dìng hǎo qù Běijīng de jīpiào le.	北京行きの航空券、もう予約したよ。	B	dog	surprised	这么快！几号的？	Zhème kuài! Jǐ hào de?	そんなに早く！何日の？	「飞机票」の略語。飛行機（飞机）に乗る手続き（办理登机）をする際などに頻繁に登場します。
phrase_0148	登机口。	Dēngjīkǒu.	搭乗ゲート。	travel	2	A	me	surprised	快跑！我们的登机口关了怎么办！	Kuài pǎo! Wǒmen de dēngjīkǒu guān le zěnme bàn!	走って！搭乗ゲートが閉まったらどうしよう！	B	cat	tired	别急，还有时间呢。	Bié jí, hái yǒu shíjiān ne.	焦らないで、まだ時間あるから。	空港で最も探すべき場所。「登机（飛行機に登る＝搭乗する）」ための「口（入り口）」。案内板を見るときに必須の単語です。
phrase_0149	晚点了。	Wǎndiǎn le.	遅延しました。	travel	2	A	dog	sad	广播说我们的航班晚点了。	Guǎngbō shuō wǒmen de hángbān wǎndiǎn le.	アナウンスで私たちの便が遅延してるって。	B	sensei	tired	又是天气原因吧，只能等了。	Yòu shì tiānqì yuányīn ba, zhǐnéng děng le.	また天候のせいだろうね、待つしかないか。	「晩（遅く）＋点（時間）」になる、つまり遅延のこと。飛行機や高速鉄道でよく使われる、旅行者が一番聞きたくない単語の一つ。
phrase_0150	太棒了！	Tài bàng le!	素晴らしい！最高！	daily	1	A	panda	happy	我们终于到了！	Wǒmen zhōngyú dào le!	ついに着いたよ！	B	me	happy	太棒了！风景真美！	Tài bàng le! Fēngjǐng zhēn měi!	最高！景色が本当に綺麗！	目的地に無事に到着した時の達成感や、素晴らしい景色に感動した時など、喜びを爆発させる言葉です。